{
  "metadataVersion": "0.1.0",
  "platform": "figma",
  "scope": "production",
  "libraryVersion": "0.2.0-default-font-query",
  "sourceVersion": "view-ui-plus@1.3.24+23a8e5bd2c07143bebfbcadcfb30d6f5bd47834b",
  "registrySha256": "2e78d1acf1e7f06e36badb5716e3e7ba1fe3a5f39138ff8e13ddb7bc529d72cb",
  "bindings": {
    "action.button.primary.medium": {
      "variants": {
        "default": {
          "kind": "component",
          "fileReference": "0vGWSRoLxBiVPXiZ8xJAX9",
          "componentReference": "135:15",
          "fidelityReportSha256": "ac50d26db0d2cc0bc8ac18d1bf193b1055bf37119a7ab38afcf9f61b1f497d3a"
        }
      }
    }
  }
}
